{
  "schemaVersion": "1.0",
  "id": "official.monochrome.light",
  "name": "Monochrome Light",
  "author": "Prodivix",
  "source": "official",
  "mode": "light",
  "semantic": {
    "surface": {
      "canvas": "{palette.gray.0}",
      "panel": "{palette.gray.1}",
      "raised": "{palette.gray.2}"
    },
    "text": {
      "primary": "{palette.gray.13}",
      "secondary": "{palette.gray.10}",
      "muted": "{palette.gray.7}",
      "inverse": "{palette.gray.0}"
    },
    "border": {
      "subtle": "{palette.gray.3}",
      "default": "{palette.gray.4}",
      "strong": "{palette.gray.7}"
    },
    "accent": {
      "default": "{palette.gray.13}",
      "hover": "{palette.gray.11}"
    },
    "success": {
      "default": "{palette.green.8}",
      "hover": "{palette.green.9}",
      "subtle": "{palette.green.2}",
      "subtleHover": "{palette.green.3}"
    },
    "danger": {
      "default": "{palette.red.7}",
      "hover": "{palette.red.8}",
      "subtle": "{palette.red.3}",
      "subtleHover": "{palette.red.2}"
    },
    "warning": {
      "default": "{palette.yellow.6}",
      "hover": "{palette.yellow.7}",
      "subtle": "{palette.yellow.3}",
      "subtleHover": "{palette.yellow.2}"
    },
    "info": {
      "default": "{palette.blue.7}",
      "hover": "{palette.blue.8}",
      "subtle": "{palette.blue.2}",
      "subtleHover": "{palette.blue.3}"
    }
  },
  "product": {
    "editor": {
      "canvasBackground": "{semantic.surface.canvas}",
      "selectionOutline": "{semantic.accent.default}",
      "dropIndicator": "{semantic.accent.default}"
    },
    "editorBar": {
      "background": "{palette.gray.11}",
      "icon": "{palette.gray.2}",
      "iconHover": "{palette.gray.0}",
      "iconHoverBackground": "rgb(255 255 255 / 0.08)"
    },
    "inspector": {
      "rowHover": "{palette.gray.2}",
      "fieldLabel": "{semantic.text.secondary}",
      "fieldControl": "{semantic.text.primary}"
    },
    "nodeGraph": {
      "nodeBackground": "{semantic.surface.panel}",
      "nodeBorder": "{semantic.border.default}",
      "portColor": "{semantic.text.secondary}"
    },
    "home": {
      "logo": "{palette.gray.13}",
      "heroText": "{palette.gray.12}",
      "heroHighlight": "{palette.gray.13}",
      "subtitle": "{palette.gray.8}",
      "navIcon": "{palette.gray.10}",
      "navIconHoverBg": "{palette.gray.1}",
      "navIconHoverText": "{palette.gray.13}",
      "profileBg": "{palette.gray.1}",
      "profileHoverShadow": "0 10px 18px rgb(0 0 0 / 0.12)",
      "footerText": "{palette.gray.10}"
    }
  },
  "typography": {
    "fontFamily": {
      "ui": "Inter, 'HarmonyOS Sans', -apple-system, BlinkMacSystemFont, 'Segoe UI', Roboto, sans-serif",
      "mono": "JetBrains Mono, Consolas, monospace",
      "canvas": "{typography.fontFamily.ui}"
    },
    "fontSize": {
      "micro": "10px",
      "caption": "11px",
      "2xs": "10px",
      "xs": "12px",
      "sm": "13px",
      "md": "14px",
      "lg": "16px",
      "xl": "18px",
      "2xl": "20px",
      "3xl": "24px",
      "4xl": "30px",
      "5xl": "36px",
      "hero": "64px"
    },
    "fontWeight": {
      "regular": "400",
      "medium": "500",
      "semibold": "600",
      "bold": "700",
      "extrabold": "800"
    },
    "lineHeight": {
      "tight": "1",
      "compact": "1.3",
      "editor": "1.45",
      "normal": "1.5"
    }
  },
  "radius": {
    "none": "0",
    "sm": "4px",
    "md": "8px",
    "lg": "12px",
    "full": "9999px"
  },
  "shadow": {
    "sm": "0 1px 2px 0 rgb(0 0 0 / 0.05)",
    "md": "0 4px 6px -1px rgb(0 0 0 / 0.1)",
    "lg": "0 10px 15px -3px rgb(0 0 0 / 0.1)"
  },
  "density": {
    "spacing": {
      "none": "0",
      "xs": "4px",
      "sm": "8px",
      "md": "16px",
      "lg": "24px",
      "xl": "32px",
      "2xl": "48px"
    },
    "controlHeight": {
      "sm": "24px",
      "md": "28px",
      "lg": "32px"
    }
  },
  "motion": {
    "duration": {
      "fast": "150ms",
      "normal": "300ms"
    },
    "easing": {
      "standard": "ease"
    }
  },
  "metadata": {
    "description": "Default monochrome light theme with multi-color 0-13 palette scales.",
    "tags": ["official", "monochrome", "light"],
    "license": "MIT"
  }
}
